<?xml version="1.0" encoding="utf-8"?>
<xs:schema targetNamespace="DS_DELPPWConfiguration" xmlns:tns="DS_DELPPWConfiguration"
  xmlns:xs="http://www.w3.org/2001/XMLSchema" attributeFormDefault="unqualified" elementFormDefault="qualified">
  <xs:element name="AttributesDescriptionList">
    <xs:complexType>
      <xs:sequence>
        <xs:element maxOccurs="unbounded" name="Type" type="tns:Type"/>
      </xs:sequence>
      <xs:attribute name="Title" type="xs:string" use="required"/>
      <xs:attribute name="Description" type="xs:string" use="required"/>
    </xs:complexType>
  </xs:element>

  <xs:complexType name="Type">
    <xs:sequence>
    <xs:element maxOccurs="unbounded" name="Section" type="tns:Section"/>
    </xs:sequence>
    <xs:attribute name="name" type="xs:string" use="required"/>
    <xs:attribute name="formStyle" type="xs:string"/>
  </xs:complexType>

  <xs:complexType name="Section">
    <xs:sequence>
    <xs:element maxOccurs="unbounded" name="Attribute" type="tns:Attribute"/>
    </xs:sequence>
    <xs:attribute name="name" type="xs:string"/>
  </xs:complexType>

  <xs:complexType name="Attribute">
    <xs:sequence>
        <xs:element name="dicoType" maxOccurs="unbounded" minOccurs="0">
        <xs:complexType>
            <xs:simpleContent>
            <xs:extension base="xs:string">
                <xs:attribute type="xs:string" name="dicoType" use="optional"/>
            </xs:extension>
            </xs:simpleContent>
        </xs:complexType>
        </xs:element>
    </xs:sequence>
    <xs:attribute name="name" type="xs:string" use="required"/>
    <xs:attribute name="dicoType" type="xs:string"/>
    <xs:attribute name="entity" type="xs:string"/>
    <xs:attribute name="mandatory" type="xs:boolean"/>
    <xs:attribute name="displayType" type="xs:string"/>
    <xs:attribute name="defaultValue" type="xs:string"/>
  </xs:complexType>

</xs:schema>
