<?xml version="1.0" encoding="UTF-8"?>
<!-- Copyright DASSAULT SYSTEMES 2015 -->
<AttributesDescriptionList Title="Attributes Description List by Types" Description="Sample configuration file delivered by DS." xmlns="DS_DELPPWConfiguration" xmlns:xsi="http://www.w3.org/2001/XMLSchema-instance" xsi:schemaLocation="DS_DELPPWConfiguration ../xsd/InsertCmdFormAttribute.xsd">
	<Type name="CreateAssembly">
		<Section name="Section.Attributes">
			<Attribute name="V_Name" dicoType="PLMEntity" mandatory="true" />
			<Attribute name="V_description" dicoType="PLMEntity" />
            <Attribute name="V_Outsourced" dicoType="CreateAssembly"/>
		</Section>
	</Type>
	<Type name="CreateMaterial">
		<Section name="Section.Attributes">
			<Attribute name="V_Name" dicoType="PLMEntity" mandatory="true" />
			<Attribute name="V_description" dicoType="PLMEntity" />
            <Attribute name="V_Outsourced" dicoType="CreateMaterial"/>
		</Section>
	</Type>
	<Type name="CreateKit">
		<Section name="Section.Attributes">
			<Attribute name="V_Name" dicoType="PLMEntity" mandatory="true" />
			<Attribute name="V_description" dicoType="PLMEntity" />
		</Section>
	</Type>
	<Type name="Provide">
		<Section name="Section.Attributes">
			<Attribute name="V_Name" dicoType="PLMEntity" mandatory="true" />
			<Attribute name="V_description" dicoType="PLMEntity" />
		</Section>
	</Type>
    <!--<Type name="ProcessContinuousProvide">
		<Section name="Section.Attributes">
			<Attribute name="V_Name" dicoType="PLMEntity" mandatory="true" />
			<Attribute name="V_description" dicoType="PLMEntity" />
            <Attribute name="V_ContQuantity" >
                <dicoType dicoType="DELFmiContQuantity_Mass" />
                <dicoType dicoType="DELFmiContQuantity_Area" />
                <dicoType dicoType="DELFmiContQuantity_Length" />
                <dicoType dicoType="DELFmiContQuantity_Volume" />
    	    </Attribute> 
		</Section>
	</Type>-->
</AttributesDescriptionList>
